2026-05-28,29867.86972756,2375.29841711,9245.54176286,22807.81835423,中际旭创、兆易创新、工业富联、中芯国际、新易盛、长电科技、天孚通信、华天科技、京东方Ａ、寒武纪,7.9526877503360724,30.9548081171951,76.3623872819578,4098.64
2026-05-29,33404.47256813,2546.89051749,10398.19273297,25365.25779294,中际旭创、天孚通信、工业富联、兆易创新、长电科技、亨通光电、新易盛、中芯国际、宁德时代、立讯精密,7.624399733585066,31.128145225949595,75.93371738232466,4068.57
2026-06-01,28960.31624163,2219.35342395,8872.2917162,21817.96650337,中际旭创、东山精密、兆易创新、长电科技、工业富联、新易盛、天孚通信、京东方Ａ、亨通光电、胜宏科技,7.663429520012334,30.636031879535274,75.33745944392352,4057.74
2026-06-02,28124.29405939,2274.39153466,8816.39361078,21411.84816072,中际旭创、工业富联、新易盛、兆易创新、东山精密、天孚通信、长电科技、中天科技、立讯精密、宁德时代,8.086928439366952,31.34796412013914,76.13292662743697,4075.1
2026-06-03,31526.01915506,2880.7523248400003,10523.53339466,24701.09330077,中际旭创、新易盛、工业富联、天孚通信、兆易创新、东山精密、长电科技、澜起科技、寒武纪、京东方Ａ,9.137697692407933,33.38047009011903,78.3514505249719,4083.97
2026-06-04,27787.8655944,2204.21458186,8768.45655138,21396.82114083,兆易创新、中际旭创、亨通光电、工业富联、京东方Ａ、东山精密、新易盛、佰维存储、胜宏科技、长电科技,7.932291792516113,31.55498403284015,77.0005924641511,4057.78
2026-06-05,31001.86102973,2806.85572018,10014.87699339,23939.65091904,中际旭创、京东方Ａ、新易盛、兆易创新、亨通光电、天孚通信、工业富联、东山精密、胜宏科技、中天科技,9.053829760375663,32.30411549740832,77.22004461629733,4027.74
2026-06-08,28227.95887599,2264.56027146,8422.78871988,21165.87792025,中际旭创、京东方Ａ、中天科技、亨通光电、新易盛、兆易创新、天孚通信、胜宏科技、沪电股份、东山精密,8.022401766307583,29.838461777851798,74.98196385092926,3959.34
2026-06-09,26663.01614533,2271.64169132,8391.2407864,20526.464010390002,中际旭创、新易盛、京东方Ａ、中天科技、兆易创新、亨通光电、沪电股份、胜宏科技、东山精密、天孚通信,8.51982265974015,31.47146122052556,76.9847788356277,4010.03
2026-06-10,26437.46311974,1982.30238646,7971.88350593,20153.74189136,中际旭创、新易盛、亨通光电、京东方Ａ、中天科技、海光信息、天孚通信、寒武纪、兆易创新、东山精密,7.498080952328133,30.153738540736352,76.2317541591646,3993.23
2026-06-11,25744.43323765,1969.4072488,7877.8982686,19775.60012162,新易盛、中际旭创、亨通光电、京东方Ａ、中天科技、烽火通信、兆易创新、东山精密、天孚通信、寒武纪,7.649837270139768,30.600395028619047,76.81505333238073,3987.01
2026-06-12,32353.83131675,2194.70100071,9928.47940295,25170.72603245,中际旭创、新易盛、亨通光电、兆易创新、佰维存储、寒武纪、东山精密、京东方Ａ、中天科技、宁德时代,6.783434639389291,30.68718293591986,77.7982854210493,4031.51
2026-06-15,30502.2295915,2246.16464407,9194.71568574,23557.28776318,中际旭创、新易盛、兆易创新、亨通光电、寒武纪、东山精密、紫金矿业、京东方Ａ、天孚通信、中天科技,7.363935929116259,30.144405208668008,77.23136334186097,4096.47
2026-06-16,30859.88667196,2071.53791631,9526.33023833,24062.01519565,中际旭创、东山精密、亨通光电、兆易创新、新易盛、天孚通信、中天科技、生益科技、胜宏科技、京东方Ａ,6.712720426780591,30.86962158868147,77.97181970053474,4091.89
2026-06-17,31137.34816157,2216.54411759,10121.99500935,24571.68956883,兆易创新、中际旭创、东山精密、亨通光电、新易盛、生益科技、澜起科技、长电科技、佰维存储、寒武纪,7.118602734209971,32.50756922788518,78.91388001742745,4108.08
2026-06-18,33312.55794506,2769.65313303,11011.89961964,26450.31225124,中际旭创、兆易创新、工业富联、寒武纪、京东方Ａ、新易盛、亨通光电、澜起科技、东山精密、长电科技,8.31414128449034,33.0563015839286,79.40042399284557,4090.48
2026-06-22,37615.96967405,2626.63560079,12055.38451052,29549.08352536,中际旭创、兆易创新、新易盛、京东方Ａ、东山精密、宁德时代、工业富联、澜起科技、东方财富、寒武纪,6.982767222406679,32.048581001586165,78.5546239573479,4163.1
2026-06-23,34656.35816441,2482.72307616,11363.806103930001,27311.92476631,兆易创新、中际旭创、新易盛、东方财富、亨通光电、澜起科技、寒武纪、中天科技、京东方Ａ、长电科技,7.1638314227419535,32.789960358846784,78.80783271208718,4106.25
2026-06-24,33064.87393169,2547.59027999,10807.58126064,26122.41593937,兆易创新、中际旭创、立讯精密、京东方Ａ、长电科技、新易盛、中芯国际、寒武纪、亨通光电、中天科技,7.704823811677507,32.68598961837205,79.00352498950186,4110.81
2026-06-25,36181.34898453,2966.58096225,12368.48769497,29034.72172567,中际旭创、新易盛、兆易创新、京东方Ａ、天孚通信、澜起科技、寒武纪、佰维存储、海光信息、东山精密,8.199199437031538,34.184705772740465,80.24775897129852,4120.28
2026-06-26,35743.06288776,3015.43624089,12382.95101545,28903.94684659,中际旭创、兆易创新、京东方Ａ、新易盛、长电科技、中天科技、立讯精密、亨通光电、佰维存储、澜起科技,8.436423734471335,34.64434778388974,80.8658925995063,4027.26
2026-06-29,35385.25749658,2904.31003354,12039.86203168,28341.1424031,兆易创新、中际旭创、京东方Ａ、长电科技、澜起科技、新易盛、寒武纪、华工科技、佰维存储、中天科技,8.207683761579812,34.02507960509729,80.09307945784818,4073.9
2026-06-30,32934.85882809,2830.36447576,11005.61213989,26467.3253561,京东方Ａ、兆易创新、中际旭创、新易盛、澜起科技、寒武纪、长电科技、胜宏科技、华工科技、立讯精密,8.593826044719506,33.416302760962076,80.36265008528328,4094.4
2026-07-01,36887.35783405,2825.81247042,12128.71482195,29199.82881551,兆易创新、京东方Ａ、中际旭创、新易盛、澜起科技、长电科技、阳光电源、中天科技、东方财富、佰维存储,7.660652961735165,32.8804108890505,79.15944792488284,4112.45
2026-07-02,34733.18780305,2767.19177967,11087.21606457,27167.76529846,京东方Ａ、中际旭创、新易盛、兆易创新、澜起科技、多氟多、寒武纪、东山精密、长电科技、中微公司,7.966996278490184,31.921101303567667,78.21846198659121,4028.9
2026-07-03,32046.8709981,2576.78080151,10097.80697894,24937.55021453,兆易创新、中际旭创、京东方Ａ、新易盛、东山精密、澜起科技、德明利、中国巨石、长电科技、亨通光电,8.040662695783226,31.509494264006864,77.81586606695082,4043.64
